{
  "format": 1,
  "status": "exact_execution_passed_resource_cleanup_open",
  "date": "2026-10-15",
  "source": {
    "candidate_files": 922,
    "candidate_tree_sha256": "88dd9d363194af6c52809fabcd82b9c7e6cba2ee136c95ae161e40a67aebb0eb",
    "compiled_input_count": 530,
    "compiled_inputs_sha256": "736afd80010cdd41fe27752f632001df3cc84e174e62e3ac385d002e6bf1ce93",
    "full_source_unchanged_after_Native": true,
    "whole_main_tree_equality_claimed": false,
    "actual_main_adoption_receipt": "evidence/experimental-original-graph-waits-2026-10-15/adoption/actual-main/receipt.json",
    "adoption_base_commit": "a9b265d5b3a96e0e5bbed604b7558f4ae9edc136",
    "actual_main_compiled_inputs_equal": 530,
    "new_RFC24_RFC25_and_history_retained": true
  },
  "static": {
    "six_gates": [
      "fmt",
      "strict_workspace_clippy",
      "workspace_all_targets_all_features_locked",
      "independent_doctests",
      "strict_rustdoc",
      "fixed_nightly_2026_10_07_check"
    ],
    "all_exit_zero": true,
    "workspace_passed": 2064,
    "workspace_original_ignored": 6,
    "doctests_passed": 45,
    "database_qualification_from_static": false
  },
  "build": {
    "four_fresh_binaries": {
      "stateknot-store-postgres": {
        "package": "stateknot-store-postgres",
        "package_id": "path+file:///Users/jiawy/Documents/RustAgentFramework/.local-verification/2026-10-15/elapsed36-attempt-proof-final-test-source/crates/stateknot-store-postgres#0.1.0-alpha.1",
        "path": "/Users/jiawy/Documents/RustAgentFramework/.local-verification/2026-10-15/elapsed36-attempt-proof-integration/final-test-fixes-v1/strict-store-build-v1/stateknot-store-postgres-postgres",
        "sha256": "f7d99e3e0ffc9e27cd4b397a689366639d5f25cc28f00532e78fe9c7e7b70fb0",
        "fresh": false,
        "exact_test_count": 264,
        "exact_names": [
          "artifact_registry_is_exact_tenant_scoped_and_lineage_safe",
          "atomic_agent_admission_is_scheduler_ready_retry_exact_and_tamper_evident",
          "barrier_consumption_failure_rolls_back_event_checkpoint_and_run_heads",
          "barrier_rejects_complete_results_while_external_invocations_are_unsettled",
          "barrier_rejects_incomplete_conflicting_and_stale_fenced_inputs_without_mutation",
          "cancellation_blocks_new_model_work_but_accepts_an_inflight_response",
          "cancellation_blocks_new_pending_results_but_preserves_committed_idempotency",
          "cancellation_blocks_new_tool_work_but_accepts_an_inflight_result",
          "checkpoint_commit_recovery_idempotency_and_projection_binding",
          "checkpoint_commits_fence_stale_workers_but_preserve_lost_ack_retries",
          "checkpoint_lineage_pages_are_exact_bounded_and_advance_safe",
          "checkpoint_load_fails_closed_on_corrupt_bytes_and_journal_anchor",
          "child_upgrade::migration_twenty_preserves_v19_admissions_and_fences_existing_declared_graphs",
          "claimed_recovery_migration_eleven_preserves_unfenced_v1_quarantine_evidence",
          "claimed_recovery_plans_fresh_ready_nodes_deterministically",
          "claimed_recovery_plans_superseded_attempt_for_crash_takeover",
          "claimed_recovery_quarantine_cannot_cross_a_successor_fence",
          "claimed_recovery_ready_plan_treats_missing_checkpoint_as_ordinary_state",
          "claimed_recovery_reuses_attempt_owned_results_as_barrier_input",
          "claimed_recovery_revalidates_and_quarantines_a_missing_pinned_graph",
          "claimed_run_recovery_requires_exact_live_fence_and_journal_observation",
          "complete_development_config_migrates_connects_and_health_checks",
          "concurrent_agent_admissions_converge_and_late_failure_rolls_back_all_rows",
          "concurrent_appenders_converge_to_one_contiguous_history",
          "concurrent_checkpoint_writers_form_one_linear_barrier_chain",
          "concurrent_graph_registrations_choose_one_immutable_version",
          "concurrent_identical_barriers_converge_on_one_physical_commit",
          "concurrent_identical_interrupt_resolutions_converge_on_one_commit",
          "concurrent_identical_node_attempt_retries_converge_on_one_physical_winner",
          "concurrent_identical_quarantine_requests_converge_on_one_record",
          "concurrent_invocation_advances_admit_exactly_one_physical_attempt",
          "concurrent_model_advances_admit_exactly_one_physical_attempt",
          "concurrent_outbox_claims_are_unique_durable_and_lost_ack_safe",
          "concurrent_scheduler_replicas_share_one_linear_fairness_cursor",
          "concurrent_schedulers_claim_exactly_one_discovered_run",
          "current_migrations_upgrade_existing_v1_history_without_guessing_projection_intent",
          "delayed_retry_that_becomes_due_keeps_ownership_for_replanning",
          "delayed_retry_wakeup_is_plan_bound_idempotent_and_scheduler_visible_when_due",
          "due_and_expired_wait_discovery_pages_are_bounded_stable_and_tenant_scoped",
          "durable_agent_submission_keys_converge_conflict_and_roll_back_atomically",
          "expired_renewal_retry_confirms_only_the_already_committed_expiry",
          "failed_invocation_projection_update_rolls_back_event_and_revision",
          "failed_model_projection_update_rolls_back_event_claim_and_revision",
          "failure_after_checkpoint_insert_rolls_back_every_projection",
          "failure_after_event_insert_rolls_back_event_and_head_together",
          "frame_application_replay::actual_noninitial_leaf_replay_covers_root_and_child_without_dispatch",
          "frame_application_replay::actual_update_calls_the_pinned_reducer_once_and_limits_are_operational",
          "frame_application_replay::administrative_component_change_after_capture_is_not_hidden_by_the_same_journal",
          "frame_application_replay::callback_journal_progress_successor_fence_and_expiry_reject_the_original_handoff",
          "frame_application_replay::callback_projection_changes_reject_the_original_observation_but_lease_renewal_is_allowed",
          "frame_application_replay::callbacks_can_reuse_a_one_connection_store_and_obtain_the_run_mutation_lock",
          "frame_application_replay::crossed_leaf_wrong_reducer_and_resolver_panic_never_quarantine",
          "frame_application_replay::deployed_reducer_successor_mismatch_is_fenced_corruption",
          "frame_application_replay::fresh_child_input_schema_availability_and_rejection_are_distinct",
          "frame_application_replay::legacy_root_dispositions_without_a_complete_bundle_are_operational",
          "frame_application_replay::maximum_legal_individual_json_replays_with_a_sufficient_local_result_limit",
          "frame_application_replay::missing_exact_reducer_is_operational_and_fresh_entry_schema_is_replayed",
          "frame_application_replay::reducer_availability_resource_limit_and_panic_never_quarantine_durable_data",
          "frame_application_replay::returned_child_and_root_consumption_are_replayed_after_the_final_pop",
          "frame_application_replay::root_only_eight_sixteen_and_thirty_two_edges_have_linear_actual_visits",
          "frame_application_replay::scoped_interrupt_and_timer_resume_replay_original_wait_without_an_extra_transition",
          "frame_application_replay::scoped_linear_history_replays_eight_sixteen_and_thirty_two_edges_once",
          "frame_application_replay::sequential_returned_siblings_and_seven_noninitial_suspended_parents_are_all_replayed",
          "frame_application_replay::seven_level_open_and_returned_cascade_replays_all_lifetime_scopes_on_default_stack",
          "frame_application_replay::whole_root_returned_siblings_preserve_complete_application_replay",
          "frame_barriers::nested_entry_after_scoped_barrier_authenticates_parent_successor_and_usage_floor",
          "frame_barriers::reserved_scoped_barrier_event_cannot_commit_through_ordinary_append",
          "frame_barriers::rewritten_scoped_barrier_bytes_are_rejected_by_whole_and_checkpoint_recovery",
          "frame_barriers::scoped_barrier_race_consumes_once_and_whole_retry_survives_takeover",
          "frame_barriers::scoped_barrier_rechecks_lease_after_slow_deferred_constraints",
          "frame_barriers::scoped_barrier_stale_fence_and_incomplete_shared_usage_create_no_facts",
          "frame_barriers::scoped_barrier_write_faults_roll_back_event_state_consumption_witness_and_heads",
          "frame_barriers::scoped_successor_dispatch_authenticates_all_barriers_and_keeps_root_suspended",
          "frame_barriers::source_schema_28_upgrade_preserves_populated_scoped_history_before_real_barrier_commit",
          "frame_callers::framework_caller_epoch_race_recovers_once_without_reentering_child",
          "frame_callers::framework_rebinding_deferred_delay_cannot_commit_after_live_lease_expires",
          "frame_callers::framework_rebinding_preserves_original_retry_budget_and_bounded_physical_history",
          "frame_callers::framework_rebinding_rejects_checksum_valid_witness_rewrite_then_recovers_original",
          "frame_callers::framework_rebinding_write_faults_roll_back_every_component_and_projection",
          "frame_callers::framework_takeover_at_noninitial_checkpoint_charges_shared_budget_before_barrier",
          "frame_callers::reserved_framework_binding_event_requires_the_whole_transaction",
          "frame_callers::scoped_parent_caller_can_rebind_while_its_existing_leaf_remains_active",
          "frame_callers::source_schema_29_upgrade_preserves_real_barrier_history_before_rebinding",
          "frame_child_topology::original_frame_active_ceiling_refuses_the_next_valid_root_grandchild",
          "frame_child_topology::original_frame_depth_ceiling_rejects_a_declared_target_with_too_much_depth",
          "frame_child_topology::original_frame_room_allows_two_grandchildren_in_the_same_per_run_account",